headlines,text,
"14,200 HIV+ individuals' data illegally leaked: Singapore","Singapore's health ministry said details of 14,200 individuals, diagnosed with HIV, were ""illegally disclosed online"" by a US citizen. The ministry added the breach targeted data of Singaporean citizens diagnosed with HIV up to January 2013 and foreigners diagnosed with HIV up to December 2011. Last year, Singapore PM Lee Hsien Loong and 15 lakh citizens' healthcare data was stolen.",
No truth: Paytm CEO on reports of scaling down Paytm Mall,"Paytm CEO Vijay Shekhar Sharma, denying reports of scaling down the startup's e-commerce unit Paytm Mall's B2C operations, said, there's ""no truth"" to these claims. The marketplace is expected to double gross merchandise value (GMV) to $2 billion by March this year, Sharma said. Referring to Paytm's wholesale B2B vertical, he added, it's ""budgeted to contribute...10-15% of total Mall GMV"". ",
Nissan faces SEC probe in US over executive pay: Reports,"US financial regulator SEC is probing automaker Nissan reportedly over the disclosure of its executive pay in the US. This comes after the company's ousted Chairman Carlos Ghosn's arrest over allegations of under-reporting income. Nissan's CEO Hiroto Saikawa had said oversights in the company's corporate governance ""permitted the situation to continue, which clearly calls for grave reflection.""",
No credence to rumours: Bhavin Turakhia on startup Flock sale,"Mumbai-based work messaging service startup Flock's Founder Bhavin Turakhia while denying reports of selling the startup to America's Dropbox said, ""There is no credence to the rumours"". He further added Flock is in talks with storage services provider Dropbox in connection with a potential partnership. ""Flock is aggressively expanding...there are no intentions to sell the company,"" Turakhia added.",
"Thieves loot PNB Trichy branch, also take away CCTV footage","Burglars broke into a Punjab National Bank (PNB) branch in Tamil Nadu's Trichy district and escaped with jewellery worth over ₹5 crore, some cash and the CCTV footage. They gained entry into the bank by making a hole at the back of the building, the police said. The robbery was discovered on Monday when employees returned from their weekly holiday.",
"Continue mine rescue efforts: SC to Centre, Meghalaya govt","The Supreme Court has asked the Centre and Meghalaya government to continue operations to rescue the miners trapped in a rat-hole mine in Meghalaya since December 13. The apex court was hearing a PIL seeking urgent steps for rescuing the miners. While the decomposed body of a miner has been retrieved, operation to pull out a second body is underway.",
Unconstitutional if full budget is presented: Yashwant Sinha,"Amid reports that a full-fledged budget may be presented during the interim budget session, former Union Finance Minister Yashwant Sinha has said that doing so will be ""unconstitutional"". The government cannot present an economic survey, bring Finance Bill or introduce new services, he added. ""Those saying there's no rule against...full budget, why do we have Article 116"", he further said. ",
No tennis for Karti if he evades ED: Supreme Court,"While hearing Karti Chidambaram's plea seeking permission to travel to France, Spain, Germany and the UK for tennis tournaments, the Supreme Court said, ""No tennis for him if he evades [the Enforcement Directorate]."" The apex court further directed the ED to fix a date for the interrogation. Karti is an accused in the INX Media and Aircel-Maxis money laundering cases.",
Seriously thinking of running for US Prez: Starbucks ex-CEO,"Starbucks' former CEO Howard Schultz has said he's ""seriously thinking"" of running for the US President. The 65-year-old added he'll run as a centrist independent although he described himself as a ""lifelong Democrat"". Having worked at Starbucks for nearly four decades, Schultz is credited with expanding the Seattle-based coffeehouse chain from 11 cafes to more than 28,000 in 77 countries.",
Thief steals ₹1.3cr painting from Russia gallery as witnesses watch,"A 20th-Century painting by Russian artist Arkhip Kuindzhi was stolen in broad daylight from the New Tretyakov Gallery in Moscow, Russia. Onlookers watched as the suspect removed the painting from the wall and walked out of the gallery before the alarm went off. The painting was found at a construction site after the suspect revealed the location during detention.",
38 captives freed from Taliban jail by Afghan Army,"The Afghan Army has freed 38 captives from a Taliban prison in the Ghazni province,  Afghanistan's Defence Ministry said in a statement on Monday. Nine militants were killed after the Taliban clashed with the security forces during the operation. Three weapons depots and two buildings used by the militants as a prison were destroyed by the security forces.",
"Rare tornado hits Cuba; 3 killed, 172 injured",At least three people were killed and 172 others were injured after a tornado hit the Cuban capital Havana. Several homes were destroyed and coastal areas were left flooded after the tornado hit the Caribbean nation on Sunday night. President Miguel Díaz-Canel Bermúdez on Twitter shared images of the severe damage caused by the tornado.,
Leave her alone: Kangana's sister to Krish over 'Manikarnika' row,"Actress Kangana Ranaut's sister Rangoli Chandel, while addressing the controversy surrounding the directorial credits of 'Manikarnika: The Queen of Jhansi', tweeted, ""Krish chalo man liya you directed the whole film now please calm down."" ""Kangana is the leading face of the film let her enjoy this moment of her success...please leave her alone,"" she added. ",
"Policeman stopped my car, told me I'm doing the wrong films: Ranbir","Speaking at the Umang Police Show 2019, Ranbir Kapoor revealed a policeman once stopped his car and told him he's doing the wrong kind of films. ""He saw I was...inside the car, took a picture with me and gave me a lecture for half an hour,"" Ranbir added. He said the policeman told him he should play a police officer.",
Your English bahut achcha: NZ commentator to Man of the Match Shami,"During the third New Zealand-India ODI presentation ceremony, India fast bowler Mohammad Shami talked to New Zealand cricketer-turned-commentator Simon Doull in English after being awarded Man of the Match. Shami answered to Doull in English despite Virat Kohli being called to interpret. Praising the 28-year-old pacer, Doull said, ""Your English bahut achcha (Your English is very good)"". ",
"Pandya takes flying catch, 2 wickets on return after suspension","All-rounder Hardik Pandya took a flying catch to dismiss New Zealand captain Kane Williamson on his return to Team India playing XI in the third ODI today. Williamson came down the track and flicked the ball near the midwicket, where Pandya flew to his left and plucked the catch. Pandya also registered bowling figures of 10-0-45-2 in the match.",
Raj Thackeray's son Amit marries fashion designer Mitali Borude,"Maharashtra Navnirman Sena (MNS) president Raj Thackeray's son Amit Thackeray married his fiancée and fashion designer Mitali Borude in Mumbai on Sunday in a traditional Maharashtrian-style marriage ceremony. Their wedding festivities were attended by prominent politicians, Bollywood celebrities including Amitabh Bachchan and industrialists like Mukesh Ambani. The couple, who are childhood friends, had got engaged on December 11, 2017.",
PM Modi's Bengal rally shifted as venue pre-booked by TMC,"The BJP has decided to shift the venue of PM Narendra Modi's rally in West Bengal's North 24 Parganas' Thakurnagar to another nearby ground. The ground, where PM Modi was supposed to address the mega-gathering on February 2, was booked by the Trinamool Congress for a week-long religious programme. The venue did not meet the security requirements, the BJP said.",
"Author Stephen King praises Tesla's 'fart' app, Elon Musk responds","American author Stephen King praised Tesla car's 'fart' app in a tweet saying, ""I'm sort of liking the 'fart' app. Pretty stupid, but also quite amusing."" Tesla CEO Elon Musk responded to the author in a tweet saying, ""It’s an honor, sir! Thanks for owning a Tesla."" In a software update last year, Tesla added six different on-demand fart noises.",
"Ex-Karnataka CM snatches woman's mic at public meeting, video viral","In a video that has gone viral, former Karnataka CM Siddaramaiah was seen losing his cool and snatching a woman complainant's mic at a public meeting in Mysuru. Snatching the mic resulted in her dupatta being pulled off. The National Commission for Women chief Rekha Sharma said she'll raise the matter with Karnataka DGP to file an FIR against Siddaramaiah.",
Woman fined ₹25 lakh for fake molestation case threat,"The Bombay High Court has imposed a fine of ₹25 lakh on a Haryana woman who allegedly threatened to file fake molestation case against the court receiver and representatives of a Mumbai-based company. The woman, an entrepreneur, had a fight with the company over trademark infringement. She later confessed to the court that she didn't exactly mean what she said.",
Tamil Nadu man finds 3-metre-long snake in bike's headlight,"A man found a three-metre-long snake coiled inside the headlight of his bike in Tamil Nadu's Thiruvarur. He had parked his bike outside a mosque for a little while and it was during this time that the snake snuggled into his bike, report said. With the help of locals, the man removed the snake from the bike, the report added.",
"Families fight as bride refuses to cover head, cancel wedding in MP",The wedding of Varsha Sonawa and Vallabh Pancholi in Madhya Pradesh was cancelled after their families fought after the bride refused to cover her head. The groom's family objected to Varsha wearing an evening gown and insisted that she should wear saree. The groom took the entire baraat to the police station to lodge an FIR against the bride's family. ,
"SUV, gold, cash robbed from family at gunpoint in Haryana","A group of four to five thieves on Sunday stole an SUV, gold ornaments, cash and four mobile phones from a family and their friends at gunpoint at a farmhouse in Haryana, police said. The accused then locked all the victims in a room before escaping. The accused who barged into the farmhouse had covered their faces, said the police.",
Indian-origin Kamala Harris launches 2020 presidential campaign,"First-term US Democratic Senator Kamala Harris launched her 2020 presidential campaign on Sunday at a rally in her hometown Oakland. ""We are at an inflexion point in the history of our nation. We are here because the American dream and our American democracy are under attack and on the line like never before,"" the 54-year-old said criticising President Donald Trump.",
"Saurashtra into Ranji final after tons from Pujara, Jackson","Saurashtra reached the final of the Ranji Trophy after Cheteshwar Pujara and Sheldon Jackson hit tons in the second innings to help their side beat Karnataka by five wickets on Monday. Saurashtra will face Vidarbha in the final, which starts on February 3. Saurashtra are aiming to win their maiden Ranji Trophy title while Vidarbha are the current defending champions.",
Not slept much the past week: Australia team coach Langer,"Australian team coach Justin Langer said that he had not been able to sleep much before the first Test against Sri Lanka as he kept imagining the situation where Australia would get beaten at the Gabba. Speaking about the series loss to India, Langer said, ""There's no scarring there. Just adds a few layers to their [players'] character.""",
"When you stub your toe, user tweets on Brock Lesnar's photo","Reacting to wrestler Brock Lesnar's photo from the Royal Rumble shared by the WWE Universe Twitter account, a user tweeted, ""When you hit just your pinky toe against a nightstand in the dark.#RoyalRumble"". Other users reacted to the image with tweets like, ""When you realize tomorrow is Monday"" and ""When your boss comes into your cube and you're on YouTube.""",
Google Assistant to scan face to personalise commands: Report,"Google may be working on a face scanning feature for its voice-enabled Assistant that would scan users' faces to provide personalised commands on camera-equipped devices, as per a report. Further, the feature will have multi-user support that lets users invite other people to create profiles, the report added. The updated beta version of Android's Google app reportedly revealed this development. ",
4 of UK's 5 top-selling keyless cars at theft risk: Report,"According to consumer group 'Which?', many cars including four of UK's five best-selling keyless cars are at risk of being stolen using ""cheap"" technology that exploits keyless entry. Only three of 237 tested cars weren't susceptible to being both unlocked and started, the report stated. Ford Fiesta, Volkswagen Golf, Nissan Qashqai and Ford Focus were reportedly among susceptible top-selling cars.",
Employees demand BuzzFeed pay fired staff for paid time off,"Over 400 current and former employees of online media outlet BuzzFeed have demanded it pay earned paid time off (PTO) or unused vacation days to recently fired US employees. ""It is unconscionable that BuzzFeed could justify doing so for some...not others,"" the employees said. They added BuzzFeed is paying PTO to fired employees in California, where it's required by law.",
Will quit if Cong MLAs keep crossing the line: Kumaraswamy,"Accusing Karnataka Congress MLAs of ""crossing the line"", state CM HD Kumaraswamy on Monday threatened to step down from his post. ""Congress leaders have to watch all these issues...They must control their MLAs,"" he added. This comes after Congress MLA C Puttaranga Shetty had said that former Karnataka CM Siddaramaiah was his Chief Minister.",
BJP will win 2019 polls if it brings law on Ram Temple: VHP,"Vishva Hindu Parishad (VHP) chief VS Kokje has said that BJP will win the 2019 Lok Sabha elections if it makes a law facilitating construction of the Ram Temple. ""But the government is thinking that if it makes a law...it'll be challenged in court,"" he added. ""It seems...Ayodhya case isn't among the priorities of the Supreme Court,"" he further said.",
There's no trouble: Siddaramaiah after K'taka CM offered to quit,"After Karnataka Chief Minister HD Kumaraswamy threatened to step down as the CM, Congress leader Siddaramaiah said, ""There is no trouble, I will speak to HD Kumaraswamy."" ""You (media) are the people who create trouble,"" he added. Kumaraswamy on Monday threatened to step down when asked about Congress MLAs' comments that Siddaramaiah was their Chief Minister. ",
For Congress OROP is 'Only Rahul Only Priyanka': Amit Shah,"BJP President Amit Shah on Monday said that while BJP implemented One Rank One Pension (OROP), Congress brought OROP in the form of ""Only Rahul Only Priyanka"". ""While BJP's OROP is for jawans' families...Congress' OROP is for the Gandhi and Vadra family,"" he added. Congress last week appointed Priyanka Gandhi Vadra as the Congress General Secretary of Uttar Pradesh East.",
Tripura wins best tableau award at Republic Day parade,"With the theme ‘Empowering Rural Economy the Gandhian Way’, Tripura has won the award for the best state tableau at the 70th Republic Day parade. The second and third positions were bagged by Jammu and Kashmir and Punjab respectively. As many as 16 states and six ministries and departments participated in this year’s Republic Day parade.n",
China jails human rights lawyer for 'state subversion',Human rights lawyer Wang Quanzhang has been sentenced to four and a half years in prison in China for 'subversion of state power'. Quanzhang was among several others detained in 2015 under the China's crackdown on lawyers and activists. He had taken up cases including accusations of police torture and defending members of the banned Falun Gong spiritual movement.,
"Death toll rises to 58 in Brazil dam collapse, 300 still missing","The death toll from the mine dam collapse in Brazil last week has risen to 58 and more than 300 others are still missing, authorities said. The dam break caused a sea of muddy sludge to bury the cafeteria at the iron-ore mine where workers were eating lunch, before engulfing nearby houses, vehicles and roads.",
Tata Steel sells South-East Asia operations for $327 million,"Tata Steel on Monday announced its subsidiary TS Global Holdings will sell majority stake in its South-East Asian operations NatSteel Holdings (NSH) and Tata Steel Thailand (TSTH) to China's HBIS Group for $327 million. Tata Steel will retain 30% stake in the businesses. The Chinese state-owned group is amongst the largest steelmakers in the world, Tata Steel added.",
India win an ODI series in New Zealand after 10 years,India defeated New Zealand by 7 wickets in the third ODI today to take an unassailable 3-0 lead in the five-match series. This is the first time since 2009 that India have won an ODI series in New Zealand. Virat Kohli became only the second captain after MS Dhoni to lead India to an ODI series victory in New Zealand. ,
I'm no more an orphan: Woman finds 103-yr-old mom after 61-yr search,"An 81-year-old woman named Eileen Macken who grew up in a Dublin orphanage said she's not an orphan anymore after discovering her 103-year-old mother is alive after a 61-year-long search this month. She said she ""worked tirelessly"" with a genealogist to find her blood relatives. Macken spoke to her mother over the phone and plans to meet her soon.",
I have winked at least 200 times on request: Priya Prakash Varrier,"Priya Prakash Varrier, who got famous after her wink in song 'Manikya Malaraya Poovi' became viral, has said she gets bored when people ask her to wink. ""Even today, wherever I go, they ask me to wink...I think I have winked at least 200 times on request,"" she added. Priya further said she wonders what people saw in that wink.",
Bulls**t: Krish on Kangana's claim of directing 70% of Manikarnika,"'Manikarnika: The Queen of Jhansi' co-director Krish, while speaking about Kangana Ranaut's claim that she directed 70% of the film, said, ""It's bulls**t."" ""In the first-half of Manikarnika, 20-25% film has been shot by Kangana, while in the second-half only 10% is shot by her,"" he claimed. Krish further said he is hurt by the controversy.",
"Esha shares chat of friend calling footballer gorilla, apologises","Actress Esha Gupta has apologised on Twitter following criticism after she shared a screenshot of a chat with a friend, wherein the friend called Nigerian footballer Alexander Iwobi a gorilla. Esha had replied, ""Hahahahahah...I honestly dunno why they don't bench him more."" In her apology, she wrote, ""Was bad on my part, being a sports lover...Sorry guys forgive the stupidity.""",
"Congress wants 'defenestration' of PM, BJP: Shashi Tharoor","Senior Congress leader Shashi Tharoor on Monday said that his party wants 'defenestration' of Prime Minister Narendra Modi and the BJP. He added that the Congress will pull out all the ""stops"" before the 2019 general elections. Speaking on Priyanka Gandhi's induction as the Congress' general secretary, Tharoor said she has the charisma to galvanise voters.",
"FIR against Flipkart Co-founder, CEO for 'cheating' laptop buyer","Police have registered an FIR against Flipkart Co-founder Sachin Bansal and CEO Kalyan Krishnamurthy for cheating, criminal breach of trust and forgery on a Ghaziabad-based lawyer's complaint. He alleged that Flipkart sold him a laptop having features different from what was mentioned at the time of sale. He claimed Flipkart initially agreed to replace the product but didn't replace it.",
IAF Jaguar fighter plane crashes in UP's Kushinagar,"An Indian Air Force (IAF) Jaguar fighter plane on Monday crashed in Uttar Pradesh's Kushinagar. The fighter plane crashed in a non-residential area of Kushinagar and no casuality has been reported. The plane had taken off from the Gorakhpur Air Force base and was on a routine mission. The pilot of the plane ejected safely, IAF said in a statement.",
Proud to be 1st Hindu-American to run for President: Tulsi Gabbard,"US Democratic Presidential aspirant Tulsi Gabbard has said that she's ""proud to be the first Hindu-American to run for President"". Gabbard was born in American Samoa to a Samoan-European father and a mother who is of European descent but practises Hinduism. The 37-year-old lawmaker from Hawaii adopted Hinduism when she was a teenager.",
Anil to undergo treatment for shoulder calcification in Germany,"Anil Kapoor has revealed that he has suffered ""one or two tears"" and ""a bit of calcification on his right shoulder"" and will be going to Germany for his treatment. ""I have taken an appointment in April with Dr Müller-Wohlfahrt,"" Anil added. Anil was reportedly treated by the same celebrity sports doctor last year as well for his ankle injury.",
Dad accepting Padma Shri would have been good: Kader's son,"Reacting to his late father and actor Kader Khan being conferred with Padma Shri posthumously for his contribution to cinema, Sarfaraz Khan said, ""It would have been good him accepting it."" ""But I just want to get it for my father, if God is happy with a person, he still gives respect after the person has left,"" he added. ",
"Nick Jonas' parents throw reception for him, Priyanka in US","Nick Jonas' parents, Denise Jonas and Paul Kevin Jonas Sr, threw a reception for him and Priyanka Chopra in the US on Sunday. Sharing a family picture on Instagram, Priyanka wrote, ""Thank you...for a wonderful reception...This was amazing."" A video showed Priyanka and Nick dancing to Joe Jonas' song 'Cake By The Ocean' as he performed at the reception.",
Rohit-Kohli joint 3rd in list of most century stands in ODIs,"The Indian duo of Virat Kohli and Rohit Sharma reached the joint third place in the list of most century stands in ODI cricket after going past the landmark in the 3rd India-New Zealand ODI. The duo, who registered their 16th century stand on Monday, are 10 century stands behind Sachin Tendulkar and Sourav Ganguly's tally. ",
Barcelona regain 5-pt lead after 2-0 win over Girona,Barcelona regained their five-point lead at the top of the La Liga points table after Lionel Messi scored his 26th goal of the season to help his side register a 2-0 victory over 10-man Girona. Real Madrid also moved into the third place after Karim Benzema scored twice to give his side a 4-2 win over Espanyol.,
Mughal Gardens to open for public from February 6,"The Rashtrapati Bhavan's Mughal Gardens will be open to public from February 6 to March 10, during the 2019 edition of Udyanotsav. Online booking for the visit during Udyanotsav is being introduced for the first time from this year. The gardens will be opened for special categories including for farmers, differently abled persons, paramilitary and Delhi Police on 11 March.",
"Snapdeal, ShopClues oppose revised e-comm policy extension","Domestic online retailers like Snapdeal and ShopClues have opposed the extension of the February 1 deadline for implementation of revised FDI policy on e-commerce. “An immediate...implementation of [revised policy] is important to ensure growth...of India’s small businesses,” Snapdeal Co-founder Kunal Bahl said. E-commerce platforms Amazon and Flipkart had sought for an extension of the deadline.",
IIT Roorkee's E-Cell to host its annual E-Summit 2019 on Feb 2-3,"E-Cell, IIT Roorkee is hosting its annual Entrepreneurship Summit 2019 on 2nd and 3rd February. The E-Summit presents a platform to inspire the leaders and problem solvers of today and tomorrow. With the theme “Building for the Billion”, it aims to create solutions that impact the lives of the masses through a series of exciting competitions and knowledge sessions.n",
Ola scales down investment in Foodpanda India: Report,"Ride-hailing startup Ola has reportedly more than halved its investment in food delivery startup Foodpanda India, which is owned by it. The team shifted by Ola to Foodpanda has been shifted back to the ride-hailing startup, the report added. Ola will reportedly shift focus to private labels and cloud kitchens including Great Khichdi Experiment and Lovemade brands under Foodpanda.",
Identify 36 'eco-smart' stations in 2 weeks: NGT to Railways,"The National Green Tribunal (NGT) has asked the Railways to identify at least 36 model 'eco-smart stations' within two weeks. The tribunal also asked railway administration to get water and energy audits conducted there within three months to reduce their use. After the stations are identified, an action plan may be prepared within a month, the NGT said.",
Kharge booked for remark on Bhupen Hazarika receiving Bharat Ratna,"A case has been filed against Congress leader Mallikarjun Kharge for his remarks on Bharat Ratna being conferred to Assamese artiste Bhupen Hazarika. RTI activist Raju Mahanta, who filed the case, said Kharge has hurt sentiments of Assamese people. Kharge had criticised the government for not conferring the award to spiritual leader Shivakumara Swami and rather choosing “a singer"" (Hazarika).",
"2 students critical, 15 injured as bus overturns in Andhra","At least 17 students were injured, two of them critically, after a private bus overturned in Guntur district of Andhra Pradesh on Monday. The bus was reportedly carrying over 50 students to school and overturned after hitting a culvert. The driver of the school bus is being questioned by the police.",
